{
  "schemaVersion": 1,
  "runId": "fixture-dual-3090-280w-r1",
  "createdUtc": "2026-10-10T00:00:00Z",
  "source": "fixture",
  "privacy": {
    "containsGpuUuid": false,
    "containsMachineName": false,
    "containsUserName": false,
    "containsPaths": false,
    "containsRawCommand": false
  },
  "workload": {
    "class": "llama.cpp",
    "name": "Synthetic dual-3090 llama.cpp fixture",
    "model": "Example 70B",
    "quantization": "Q4_K_M",
    "backend": "CUDA"
  },
  "protocol": {
    "warmupSeconds": 30,
    "sampleSeconds": 60,
    "intervalMilliseconds": 1000,
    "repetition": 1
  },
  "result": {
    "status": "passed",
    "throughput": {
      "promptTokensPerSecond": null,
      "generationTokensPerSecond": 21.2
    },
    "error": null
  },
  "gpus": [
    {
      "index": 0,
      "model": "NVIDIA GeForce RTX 3090",
      "driver": "fixture-driver",
      "powerLimitWatts": 280.0,
      "samples": [
        { "elapsedMilliseconds": 0, "powerDrawWatts": 248.0, "temperatureC": 66.0, "utilizationPercent": 99.0, "memoryUsedMiB": 23000.0, "memoryTotalMiB": 24576.0, "graphicsClockMHz": 1665.0 },
        { "elapsedMilliseconds": 1000, "powerDrawWatts": 252.0, "temperatureC": 67.0, "utilizationPercent": 100.0, "memoryUsedMiB": 23000.0, "memoryTotalMiB": 24576.0, "graphicsClockMHz": 1680.0 },
        { "elapsedMilliseconds": 2000, "powerDrawWatts": 250.0, "temperatureC": 68.0, "utilizationPercent": 100.0, "memoryUsedMiB": 23000.0, "memoryTotalMiB": 24576.0, "graphicsClockMHz": null },
        { "elapsedMilliseconds": 3000, "powerDrawWatts": 250.0, "temperatureC": 68.0, "utilizationPercent": 99.0, "memoryUsedMiB": 23000.0, "memoryTotalMiB": 24576.0, "graphicsClockMHz": 1695.0 }
      ]
    },
    {
      "index": 1,
      "model": "NVIDIA GeForce RTX 3090",
      "driver": "fixture-driver",
      "powerLimitWatts": 280.0,
      "samples": [
        { "elapsedMilliseconds": 0, "powerDrawWatts": 238.0, "temperatureC": 67.0, "utilizationPercent": 98.0, "memoryUsedMiB": 22900.0, "memoryTotalMiB": 24576.0, "graphicsClockMHz": 1650.0 },
        { "elapsedMilliseconds": 1000, "powerDrawWatts": 242.0, "temperatureC": 68.0, "utilizationPercent": 99.0, "memoryUsedMiB": 22900.0, "memoryTotalMiB": 24576.0, "graphicsClockMHz": 1680.0 },
        { "elapsedMilliseconds": 2000, "powerDrawWatts": 240.0, "temperatureC": 69.0, "utilizationPercent": 99.0, "memoryUsedMiB": 22900.0, "memoryTotalMiB": 24576.0, "graphicsClockMHz": 1680.0 },
        { "elapsedMilliseconds": 3000, "powerDrawWatts": 240.0, "temperatureC": 70.0, "utilizationPercent": 98.0, "memoryUsedMiB": 22900.0, "memoryTotalMiB": 24576.0, "graphicsClockMHz": 1695.0 }
      ]
    }
  ]
}
